{
    "can-modify": {
        "filesystem": true,
        "other-processes": false
    },
    "component-commands": [
        "gzip"
    ],
    "copying": {
        "authors": [
            "Nathaniel Morck Beaver"
        ],
        "license-name": "MIT (Expat) License",
        "license-url": "http://opensource.org/licenses/MIT",
        "year": 2015
    },
    "description": {
        "nilsimsa-hex": "f3bb12e916c3da561476a7d1e4bcf322a46549b729728218cbbfdc13b26cfe1c",
        "sha1-hex": "10fb1d782f10eb50f61349f4a2973362319ebb87",
        "string": "Compress a file using gzip without removing the original file."
    },
    "invocations": {
        "POSIX": {
            "changeable-arguments": {
                "file": {
                    "description-string": "Path to file to be compressed.",
                    "invocation-slice": [
                        7,
                        11
                    ],
                    "subtype": "File path.",
                    "type": "string"
                },
                "file.gz": {
                    "description-string": "Path to output compressed file.",
                    "invocation-slice": [
                        14,
                        21
                    ],
                    "subtype": "File path.",
                    "type": "string"
                }
            },
            "nilsimsa-hex": "5a152601aa9184185074c3c020603b2228c568030b2a10083276aa09b6367b4e",
            "sha1-hex": "f5b9d9dd13a9e49a65f0f455be0666a96229a049",
            "string": "gzip < file > file.gz"
        },
        "POSIX-recent-version": {
            "command-requirements-as-invoked": {
                "gzip": {
                    "version-specifier": "1.6 or later"
                }
            },
            "nilsimsa-hex": "1b000a105900100011148190a26212200006c20010d242052112002126105b2c",
            "sha1-hex": "d0ae2509d0086c92567e0183864d95be97f50f17",
            "string": "gzip -k file"
        },
        "POSIX-recent-version-long-flags": {
            "command-requirements-as-invoked": {
                "gzip": {
                    "version-specifier": "1.6 or later"
                }
            },
            "nilsimsa-hex": "3b002ab822202f105d10298cb0a113250004c34981e20280603a1003a611782c",
            "sha1-hex": "f521f470f90f4811c2d0ca70741d3254ce4eee6f",
            "string": "gzip --keep file"
        }
    },
    "relevant-urls": [
        {
            "date-known-good": "2015-05-12",
            "url-nilsimsa-hex": "60d8f3ab3231fbdaa3de37f1f0105eb5f990f96a9f16b1fa4f95f77f59a1d9af",
            "url-sha1-hex": "c8b54a257cdc941e26c282136042b33c277d996d",
            "url-string": "https://lists.gnu.org/archive/html/info-gnu/2013-06/msg00003.html"
        },
        {
            "date-known-good": "2015-05-12",
            "url-nilsimsa-hex": "bdd7a9a382a17b906ac0bf2651bc22f12789f84d396c32e6cc68d803e4ba594a",
            "url-sha1-hex": "b1bd2ff86405b81ffc9f21a877fe14c8fbfd659b",
            "url-string": "https://unix.stackexchange.com/questions/46786/how-to-tell-gzip-to-keep-original-file"
        },
        {
            "date-known-good": "2015-05-12",
            "url-nilsimsa-hex": "bac6aae2b78f324dbf30c1a3e4791f086760da587c8024b63195302324cf4aa3",
            "url-sha1-hex": "f9a888df7613ab538ce16e51ad8659aca3793b61",
            "url-string": "https://bugs.debian.org/cgi-bin/bugreport.cgi?bug=240539"
        }
    ]
}
