{
    "can-modify": {
        "filesystem": false,
        "other-processes": false
    },
    "component-command-info": {
        "grep": {
            "bash-type": "file",
            "debian": {
                "executable-path": "/bin/grep",
                "required-packages": [
                    "grep"
                ]
            },
            "requirements-in-general": {
                "authentication": "sometimes",
                "internet-connection": "never",
                "sudo": "sometimes"
            }
        },
        "less": {
            "bash-type": "file",
            "debian": {
                "executable-path": "/usr/bin/less",
                "required-packages": [
                    "less"
                ]
            },
            "requirements-in-general": {
                "authentication": "sometimes",
                "internet-connection": "never",
                "sudo": "sometimes"
            }
        }
    },
    "component-commands": [
        "grep",
        "less"
    ],
    "copying": {
        "authors": [
            "Nathaniel Morck Beaver"
        ],
        "license-name": "MIT (Expat) License",
        "license-url": "http://opensource.org/licenses/MIT",
        "year": 2015
    },
    "description": {
        "nilsimsa-hex": "3efcd29b3a75e43c4748e7b9e8a87dbd3c5700739963c6a7b7169fd3de9477ef",
        "sha1-hex": "118f2d8f8666f09b5d9c9db536d645be5f923f6c",
        "string": "Highlight non-ASCII characters (e.g. Unicode) in a text file and give the line number they are on."
    },
    "invocations": {
        "POSIX": {
            "changeable-arguments": {
                "myfile.txt": {
                    "component-command": "grep",
                    "description-string": "File or file path of text file.",
                    "invocation-slice": [
                        39,
                        49
                    ],
                    "subtype": "path",
                    "type": "string"
                }
            },
            "nilsimsa-hex": "da8f7868256c22fcd1fcec9e9420ff1b662e8c915d8a0749e0f878503658e048",
            "sha1-hex": "8f78d31acfe82ec49214053d40ad2c338a9b51aa",
            "shell-compatibility": {
                "bash": {
                    "compatible-versions-tested": [
                        "4.2.37"
                    ]
                },
                "bsh": {
                    "incompatible-versions-tested": [
                        "2.0b4"
                    ]
                },
                "csh": {
                    "compatible-versions-tested": [
                        "20110502"
                    ]
                },
                "dash": {
                    "compatible-versions-tested": [
                        "0.5.7"
                    ]
                },
                "fish": {
                    "compatible-versions-tested": [
                        "1.23.1"
                    ]
                },
                "ksh": {
                    "compatible-versions-tested": [
                        "93u+-1.2"
                    ]
                },
                "mksh": {
                    "compatible-versions-tested": [
                       "40.9.20120630"
                    ]
                },
                "posh": {
                    "compatible-versions-tested": [
                        "0.10.2"
                    ]
                },
                "tcsh": {
                    "compatible-versions-tested": [
                        "6.18.01 (Astron) 2012-02-14"
                    ]
                },
                "zsh": {
                    "compatible-versions-tested": [
                        "4.3.17"
                    ]
                }
            },
            "string": "grep -nP '[^[:ascii:]]' --color=always myfile.txt | less -R"
        },
        "POSIX-long-flags": {
            "changeable-arguments": {
                "myfile.txt": {
                    "component-command": "grep",
                    "description-string": "File or file path of text file.",
                    "invocation-slice": [
                        63,
                        73
                    ],
                    "subtype": "path",
                    "type": "string"
                }
            },
            "nilsimsa-hex": "f8c2d869056620e65268ac8a1020381b44260413fd882749c0787890365880ec",
            "sha1-hex": "c2fe383b7f8e87e5baa638b3f4f074ad2f057614",
            "shell-compatibility": {
                "bash": {
                    "compatible-versions-tested": [
                        "4.2.37"
                    ]
                },
                "bsh": {
                    "incompatible-versions-tested": [
                        "2.0b4"
                    ]
                },
                "csh": {
                    "compatible-versions-tested": [
                        "20110502"
                    ]
                },
                "dash": {
                    "compatible-versions-tested": [
                        "0.5.7"
                    ]
                },
                "fish": {
                    "compatible-versions-tested": [
                        "1.23.1"
                    ]
                },
                "ksh": {
                    "compatible-versions-tested": [
                        "93u+-1.2"
                    ]
                },
                "mksh": {
                    "compatible-versions-tested": [
                       "40.9.20120630"
                    ]
                },
                "posh": {
                    "compatible-versions-tested": [
                        "0.10.2"
                    ]
                },
                "tcsh": {
                    "compatible-versions-tested": [
                        "6.18.01 (Astron) 2012-02-14"
                    ]
                },
                "zsh": {
                    "compatible-versions-tested": [
                        "4.3.17"
                    ]
                }
            },
            "string": "grep --line-number --perl-regexp '[^[:ascii:]]' --color=always myfile.txt | less --RAW-CONTROL-CHARS"
        }
    },
    "relevant-urls": [
        {
            "url-nilsimsa-hex": "4080bb110211f908a31e0270f1001604e0d061483414a9aa4c41e07d0309082f",
            "url-sha1-hex": "fd24214c7a8d4188f9201cb5366da312b98cd918",
            "url-string": "http://lists.gnu.org/archive/html/bug-gnu-utils/2006-03/msg00000.html",
            "date-known-good": "2015-04-30"
        },
        {
            "url-nilsimsa-hex": "5a000d0a34b4645c5280a1b96340686a47d17aed39170266102ca28a4c208002",
            "url-sha1-hex": "378313cfb8ae9abe444d304d4d7b4904641719a4",
            "url-string": "https://groups.google.com/forum/#!topic/comp.unix.programmer/Auge3Bz4iCA",
            "date-known-good": "2015-04-30"
        },
        {
            "url-nilsimsa-hex": "b8f9b409479163d62fe8edf2d19c32838db97db51da61cc7630fbbef2cff11eb",
            "url-sha1-hex": "af012f8aeffe8b95af828877e98196ec60e04a8a",
            "url-string": "https://stackoverflow.com/questions/3001177/how-do-i-grep-for-all-non-ascii-characters-in-unix",
            "date-known-good": "2015-04-30"
        },
        {
            "url-nilsimsa-hex": "b9d8bf9d0503671608f9b9bec39828832818ded5d8ea9787620fc3a22f0638e7",
            "url-sha1-hex": "0cc81af19f9953b0b808bd42b001419602609394",
            "url-string": "http://superuser.com/questions/417305/how-can-i-identify-non-ascii-characters-from-the-shell",
            "date-known-good": "2015-04-30"
        }
    ]
}
