{
    "can-modify": {
        "filesystem": false,
        "other-processes": false
    },
    "component-command-info": {
        "find": {
            "bash-type": "file",
            "debian": {
                "executable-path": "/usr/bin/find",
                "required-packages": [
                    "findutils"
                ]
            },
            "requirements-in-general": {
                "authentication": "never",
                "internet-connection": "never",
                "sudo": "sometimes"
            }
        }
    },
    "component-commands": [
        "find"
    ],
    "copying": {
        "authors": [
            "Nathaniel Morck Beaver"
        ],
        "license-name": "MIT (Expat) License",
        "license-url": "http://opensource.org/licenses/MIT",
        "year": 2015
    },
    "description": {
        "nilsimsa-hex": "9e74cd22f0d68ce48ff7128166a01fa9139bbe845907d36c76472ae5a91229b1",
        "sha1-hex": "c3248866c4ec72d23e3912e1589e1781fd9b92e5",
        "string": "Find files in your home directory that you don't own."
    },
    "invocations": {
        "POSIX": {
            "changeable-arguments": {
                "$HOME": {
                    "component-command": "find",
                    "description-string": "Path to search.",
                    "invocation-slice": [
                        5,
                        10
                    ],
                    "subtype": "Path to file or directory.",
                    "type": "string"
                },
                "$USER": {
                    "component-command": "find",
                    "component-command-flag": "-user",
                    "description-string": "User login the file is not owned by.",
                    "invocation-slice": [
                        19,
                        24
                    ],
                    "subtype": "Login user name.",
                    "type": "string"
                }
            },
            "nilsimsa-hex": "a5274945a6b08943c1c52b882d9121e005b9185cbb325c3fbbc39e54e63f3788",
            "sha1-hex": "1648be79c2a5b366c37d0ec72d20736fcbf5566d",
            "string": "find $HOME ! -user $USER"
        }
    }
}
